school/sat.School Name,school/sat.Number of Test Takers,school/sat.Critical Reading Mean,school/sat.Mathematics Mean,school/sat.Writing Mean,DBN
South Richmond High School ,10.0,407.0,421.0,400.0,75R025
URBAN ACADEMY ,34.0,513.0,460.0,502.0,02M565
ACADEMY FOR LANGUAGE AND TECHNOLOGY ,,,,,09X365
HS FOR SERVICE AND LEARNING AT ERASMUS ,54.0,371.0,366.0,381.0,17K539
Professional Performng Arts School ,69.0,495.0,465.0,499.0,02M408
LOWER MANHATTAN ARTS ACADEMY ,35.0,409.0,381.0,412.0,02M308
HS of Graphic Commnctn And Art ,125.0,370.0,378.0,360.0,02M625
YABC AT GRACE DODGE HIGH SCHOOL ,13.0,367.0,378.0,358.0,10X667
WILLIAMSBURG PREP ,58.0,375.0,386.0,369.0,14K561
LANDMARK SCHOOL ,47.0,369.0,370.0,359.0,02M419
PARK EAST HIGH SCHOOL ,46.0,360.0,374.0,362.0,04M495
Queens Collegiate: A College Board School ,,,,,28Q310
MILLENNIUM ART ACADEMY ,41.0,380.0,389.0,371.0,08X312
RICHMOND HILL HIGH SCHOOL ,397.0,380.0,401.0,380.0,27Q475
BROOKLYN THEATRE ARTS HIGH SCHOOL ,,,,,18K567
URBAN ASSEMBLY SCHOOL FOR THE PERFORMIN ,34.0,349.0,370.0,363.0,05M369
ACADEMY FOR YOUNG WRITERS ,70.0,377.0,366.0,365.0,14K404
Mott Haven Village Preparatory High School ,48.0,345.0,352.0,349.0,07X473
UNIVERSITY HEIGHTS HIGH SCHOOL ,66.0,401.0,388.0,396.0,07X495
Science Skills Center High School ,104.0,419.0,421.0,409.0,13K419
FREEDOM ACADEMY ,40.0,416.0,386.0,408.0,13K509
HIGH SCHOOL FOR INTL BUS/FIN ,56.0,383.0,384.0,379.0,06M462
LIFE ACADEMY HIGH SCHOOL FOR FILM AND MUS ,,,,,21K559
Lower East Side Preparatory High School ,154.0,314.0,532.0,314.0,01M515
TALENT UNLIMITED HIGH SCHOOL ,124.0,465.0,454.0,461.0,02M519
Providing Urban Learners Success in Education HS ,10.0,349.0,346.0,364.0,10X319
HOLCOMBE L. RUCKER SCHOOL OF COMMUNITY ,34.0,374.0,362.0,366.0,08X332
Region Five Scholars' Academy ,,,,,27Q323
HS FOR YOUTH CMMTY DEVLPMT AT ERASMUS ,71.0,361.0,376.0,365.0,17K537
Urban Assembly Academy of Government and Law ,48.0,411.0,406.0,411.0,02M305
WILLIAM C BRYANT HIGH SCHOOL ,322.0,405.0,456.0,408.0,30Q445
HUMANITIES PREPARATORY ACADEMY ,37.0,433.0,405.0,417.0,02M605
Thomas Edison Vocational-Technical High School ,529.0,455.0,490.0,439.0,28Q620
SATELLITE ACADEMY FORSYTH ST ,26.0,385.0,370.0,378.0,01M458
The James Baldwin School ,45.0,421.0,419.0,394.0,02M313
HIGH SCHOOL FOR GLOBAL CITIZENSHIP ,81.0,382.0,387.0,381.0,17K528
Richard R Green High School of Teaching ,79.0,425.0,429.0,419.0,02M580
SOUTH BRONX PREPARATORY ,60.0,399.0,393.0,382.0,07X221
SCIENCE TECH RESEARCH HS AT ERASMUS ,68.0,445.0,425.0,415.0,17K543
International High School at LaFayette ,35.0,355.0,395.0,355.0,21K337
ELEANOR ROOSEVELT HIGH SCHOOL ,122.0,555.0,596.0,567.0,02M416
FOUNDATIONS ACADEMY ,28.0,373.0,377.0,359.0,14K322
RALPH MCKEE VOC-TECH HIGH SCH ,48.0,411.0,429.0,386.0,31R600
New York City Laboratory School Collab Studies ,108.0,561.0,597.0,567.0,02M412
CASCADES HIGH SCHOOL ,35.0,411.0,401.0,401.0,01M650
PREPARATORY ACADEMY FOR WRITERS ,18.0,413.0,402.0,388.0,29Q283
A Philip Randolph Campus High School ,193.0,436.0,451.0,421.0,06M540
Frank Sinatra School of the Arts ,153.0,506.0,495.0,499.0,30Q501
NEWCOMERS HIGH SCHOOL ,147.0,343.0,447.0,346.0,30Q555
HOSTOS-LINCOLN ACADEMY SCIENCE ,62.0,460.0,455.0,457.0,07X500
BRONX HAVEN HIGH SCHOOL ,15.0,335.0,342.0,372.0,07X381
MORRIS ACADEMY FOR COLLABORATIVE STUDIE ,22.0,388.0,352.0,378.0,09X297
EXIMIUS COLLEGE PREP ACADEMY ,44.0,401.0,383.0,387.0,09X250
CONCORD HIGH SCHOOL ,10.0,474.0,431.0,397.0,31R470
HIGH SCHOOL OF SPORTS MANAGEMENT ,33.0,370.0,427.0,381.0,21K348
Queens School of Inquiry ,,,,,25Q252
BRONX LAB SCHOOL ,70.0,356.0,370.0,355.0,11X265
WALTON HIGH SCHOOL ,,,,,10X430
Urban Action Academy ,,,,,18K642
Queens Gateway to Health Sciences Secondary Schoo ,89.0,525.0,532.0,515.0,28Q680
HIGH SCHOOL CMTY RESEARCH LRN ,29.0,356.0,376.0,368.0,08X540
Franklin D Roosevelt High School ,385.0,387.0,492.0,377.0,20K505
YABC AT JOHN ADAMS HIGH SCHOOL ,,,,,27Q487/27Q481
Springfield Gardens High School ,20.0,429.0,402.0,403.0,29Q420
Bronx High School for the Visual Arts ,54.0,419.0,403.0,392.0,11X418
GREGORIO LUPERON PREP SCHOOL ,60.0,342.0,384.0,333.0,06M552
CHANNEL VIEW SCHOOL FOR RESEARCH ,63.0,455.0,423.0,420.0,27Q262
Eagle Academy for Young Men ,66.0,391.0,399.0,386.0,09X231
Morris High School ,9.0,369.0,374.0,360.0,12X400
LEADERSHIP INSTITUTE ,21.0,362.0,380.0,358.0,09X276
Fordham High School for the Arts ,42.0,377.0,375.0,375.0,10X437
YABC AT FLUSHING HIGH SCHOOL ,,,,,25Q467
Manhattan Center for Science and Math ,312.0,485.0,531.0,475.0,04M435
BROOKLYN ACADEMY HIGH SCHOOL ,19.0,403.0,384.0,377.0,13K553
RIVERDALE KINGSBRIDGE ACADEMY ,101.0,475.0,479.0,470.0,10X141
GEORGE WASHINGTON CARVER HS ,68.0,425.0,435.0,418.0,29Q272
P4Q SCHOOL (@ 179) ,,,,,75Q004
WADLEIGH SECONDARY SCHOOL ,68.0,376.0,373.0,371.0,03M415
FLUSHING INTERNATIONAL HIGH SCHOOL ,57.0,325.0,415.0,311.0,25Q263
Knowledge & Power Prep Acad International HS ,,,,,10X374
BROOKLYN BRIDGE ACADEMY OF S SHORE ED CO ,20.0,389.0,358.0,369.0,18K578
FOREIGN LANGUAGE ACADEMY ,73.0,418.0,429.0,415.0,07X520
PERFORMING ARTS & TECH HIGH SCHOOL ,49.0,371.0,363.0,356.0,19K507
Brooklyn High School of the Arts ,71.0,416.0,417.0,425.0,15K656
High School for the Contemporary Arts ,40.0,359.0,340.0,338.0,11X544
World Acad for Total Community Health ,28.0,370.0,371.0,376.0,19K510
BRONX HIGH SCHOOL OF SCIENCE ,683.0,632.0,685.0,643.0,10X445
MIDDLE COLLEGE HIGH SCHOOL ,32.0,386.0,402.0,373.0,24Q520
MONROE ACAD VISUAL ARTS DESGN ,70.0,346.0,341.0,356.0,12X692
SHEEPSHEAD BAY HIGH SCHOOL ,192.0,380.0,416.0,380.0,22K495
Frederick Douglass Academy VII High School ,50.0,416.0,396.0,414.0,23K514
Bayard Rustin High School Humanities ,136.0,387.0,394.0,379.0,02M440
Felisa Rincon de Gautier Inst for Law & Pub Policy ,43.0,373.0,376.0,367.0,08X519
FORT HAMILTON HIGH SCHOOL ,581.0,416.0,486.0,409.0,20K490
EAST WEST SCHOOL OF INTERNATIONAL STUDIE ,50.0,438.0,485.0,442.0,25Q281
BEACH CHANNEL HIGH SCHOOL ,114.0,393.0,390.0,380.0,27Q410
Brooklyn College Academy High School ,109.0,459.0,460.0,446.0,22K555
Manhattan Comprehensive Night Day High School ,141.0,355.0,475.0,339.0,02M575
CROTANA ACADEMY HIGH SCHOOL ,,,,,07X321
Queens Vocational & Tech High School ,130.0,415.0,428.0,401.0,24Q600
WINGS ACADEMY ,58.0,386.0,397.0,383.0,12X684
"New Explorations into Sci, Tech and Math HS ",47.0,568.0,583.0,568.0,01M539
William H Maxwell Voc High School ,49.0,355.0,367.0,355.0,19K660
East Brooklyn Community High School ,,,,,18K673
BRONX HIGH SCHOOL OF BUSINESS ,35.0,369.0,397.0,366.0,09X412
Bronx Center for Science and Mathematics ,73.0,447.0,495.0,454.0,09X260
YABC AT WALTON HIGH SCHOOL ,,,,,10X430
BRONX HIGH SCHOOL OF MUSIC ,38.0,421.0,432.0,439.0,10X442
FOOD AND FNANCE HIGH SCHOOL ,50.0,422.0,412.0,407.0,02M288
TEACHERS PREPARATORY SCHOOL ,59.0,396.0,389.0,389.0,23K697
YABC AT G. WASHINGTON EDUCATIONAL CAMPUS ,,,,,06M457
FREDERICK DOUGLAS ACADEMY II ,33.0,414.0,410.0,406.0,03M860
VANGUARD HIGH SCHOOL ,54.0,367.0,395.0,373.0,02M449
SCHOOL FOR HUMAN RIGHTS ,21.0,357.0,391.0,343.0,17K531
Theatre Arts Production Company School ,53.0,382.0,375.0,363.0,10X225
BACCALAUREATE SCH GLOBAL EDUC ,64.0,560.0,587.0,570.0,30Q580
SECONDARY SCHOOL FOR RESEARCH ,65.0,373.0,395.0,368.0,15K464
High School of Computers and Technology ,56.0,399.0,402.0,373.0,11X275
Aviation Career & Technical Education High School ,289.0,444.0,494.0,427.0,24Q610
EAST BRONX ACADEMY FOR THE FUTURE ,22.0,415.0,390.0,397.0,12X271
NEW UTRECHT HIGH SCHOOL ,317.0,409.0,471.0,407.0,20K445
Bronx Health School High School 11x249 ,52.0,363.0,366.0,364.0,11X249
HERITAGE SCHOOL ,47.0,369.0,385.0,361.0,04M680
Progress High School For Professional Careers ,102.0,365.0,375.0,373.0,14K474
Bronx Leadership Academy High School ,116.0,402.0,397.0,396.0,09X525
BROOKLYN PREP HIGH SCHOOL ,44.0,397.0,377.0,387.0,14K488
Urban Assembly School for Applied Math Science ,,,,,09X241
East Side Community High School ,69.0,418.0,431.0,402.0,01M450
MOTT HALL HIGH SCHOOL ,63.0,424.0,421.0,410.0,05M304
GROVER CLEVELAND HIGH SCHOOL ,269.0,398.0,431.0,391.0,24Q485
SCHOOL FOR THE PHYSICAL CITY ,14.0,382.0,404.0,359.0,02M690
YABC at Automative High School ,,,,,14K923
Bronx Academy of Letters ,51.0,416.0,406.0,435.0,07X551
AUGUST MARTIN HIGH SCHOOL ,102.0,377.0,372.0,362.0,27Q400
FREDERICK DOUGLASS ACADEMY ,216.0,465.0,481.0,466.0,05M499
Jane Addams Vocational High School ,152.0,370.0,377.0,363.0,08X650
P754 X - Jeffrey M. Rapport School for Career Devt ,,,,,75X754
Brooklyn Lab School ,,,,,19K639
PATHWAYS COLLEGE PREPARATORY SCHOOL ,42.0,406.0,415.0,394.0,29Q259
THURGOOD MARSHALL ACADEMY ,52.0,423.0,434.0,404.0,05M670
YABC AT ERASMUS CAMPUS ,,,,,17K467
LIFE SCIENCES SECONDARY SCHOOL ,71.0,399.0,389.0,383.0,02M655
Institute for Collaborative Education ,42.0,484.0,478.0,472.0,02M407
Seward Park High School ,,,,,02M445
Bronx Expeditionary Learning High School ,46.0,371.0,358.0,343.0,09X227
Urban Assembly School for Careers in Sports ,58.0,381.0,423.0,384.0,07X548
DeWitt Clinton High School ,438.0,425.0,440.0,417.0,10X440
Christopher Columbus High School ,114.0,354.0,373.0,350.0,11X415
Bronx High School of Law and Community Service ,57.0,389.0,400.0,382.0,10X439
HIGH SCHOOL OF ART AND DESIGN ,212.0,427.0,423.0,418.0,02M630
BENJAMIN BANNEKER ACADEMY ,168.0,476.0,477.0,445.0,13K670
ACADEMY FOR COLLEGE PREPARATION CAREER ,50.0,401.0,412.0,404.0,17K382
METROPOLITAN CORPORATE ACADEMY ,17.0,370.0,348.0,348.0,15K530
FDNY HIGH SCH DOR FIRE & LIFE ,29.0,376.0,375.0,363.0,19K502
JAMAICA HIGH SCHOOL ,153.0,393.0,400.0,391.0,28Q470
Civic Leadership Academy ,,,,,24Q293
High School of Applied Communication ,67.0,411.0,420.0,407.0,24Q267
Samuel Gompers Vocational Technical High School ,105.0,370.0,385.0,354.0,07X655
Urban Assembly Academy History & Citizenship ,22.0,359.0,380.0,371.0,09X239
Midwood High School at Brooklyn College ,725.0,493.0,543.0,491.0,22K405
BOYS AND GIRLS HIGH SCHOOL ,143.0,369.0,367.0,366.0,16K455
BRONX REGIONAL HIGH SCHOOL ,12.0,359.0,366.0,359.0,12X480
MONROE CAMPUS ,47.0,355.0,369.0,366.0,12X690
YOUNG WOMEN LEADERSHIP SCHOOL ,48.0,451.0,445.0,470.0,04M610
MARTIN VAN BUREN HIGH SCHOOL ,343.0,402.0,411.0,398.0,26Q435
PEACE & DIVERSITY ACAD HIGH SCHOOL ,24.0,408.0,400.0,401.0,12X278
Gateway School for Environmental Research & Tech ,31.0,377.0,367.0,368.0,08X295
FRANCIS LEWIS HIGH SCHOOL ,808.0,457.0,530.0,454.0,26Q430
Robert H. Goddard High School for Communication Art ,,,,,27Q308
CANARSIE HIGH SCHOOL ,128.0,372.0,373.0,364.0,18K500
Expeditionary Learning Sch for Community Leaders ,,,,,21K572
SECONDARY SCHOOL JOURNALISM ,75.0,393.0,372.0,370.0,15K463
LEON M GOLDSTEIN HIGH SCHOOL ,239.0,543.0,578.0,559.0,22K535
BARD HIGH SCHOOL EARLY COLLEGE II ,42.0,545.0,548.0,541.0,24Q299
High School for Innovation in Advertising and Media ,,,,,18K617
INTERNATIONAL COMMUNITY HIGH SCHOOL ,33.0,322.0,335.0,327.0,07X334
Belmont Preparatory High School ,65.0,358.0,370.0,346.0,10X434
Prospect Heights High School ,12.0,388.0,373.0,374.0,17K440
ARTS & MEDIA PREPARATORY ACADEMY ,,,,,18K589
YABC AT CANARSIE HIGH SCHOOL ,,,,,18K501
ACADEMY OF ENVIRONMENTAL LEADERSHIP ,36.0,382.0,369.0,374.0,32K403
ALL CITY LEADERSHIP SECONDARY ,29.0,394.0,420.0,395.0,32K554
BROOKLYN COMMUNITY HIGH SCHOOL ,43.0,393.0,356.0,377.0,13K412
W E B DUBOIS HIGH SCHOOL ,17.0,381.0,344.0,360.0,17K489
HIGH SCHOOL VIOLIN AND DANCE ,26.0,332.0,379.0,337.0,09X543
ADLAI E STEVENSON HIGH SCHOOL ,,,,,08X450
Academy for Scholarship and Entrepreneurship ,37.0,373.0,376.0,362.0,11X270
The Frances Perkins Academy ,,,,,14K632
Urban Assembly School of Music and Art ,59.0,394.0,371.0,371.0,13K350
Community High School Social Justice ,50.0,372.0,351.0,359.0,07X427
Bronx Leadership Academy II High School ,55.0,377.0,381.0,379.0,07X527
"YOUNG ADULT BOROUGH CTR, THOMAS JEFFERS ",,,,,19K431
HIGH SCHOOL OF WORLD CULTURES ,50.0,291.0,333.0,291.0,12X550
BUSHWICK HS FOR SOCIAL JUSTICE ,72.0,363.0,364.0,358.0,32K549
Townsend Harris High School at Queens College ,273.0,637.0,644.0,642.0,25Q525
YOUNG WOMEN'S LEADERSHIP SCH BRONX CMP ,56.0,395.0,407.0,388.0,08X282
International High School @Prospect Hgt ,32.0,302.0,339.0,325.0,17K524
JOHN BOWNE HIGH SCHOOL ,302.0,391.0,423.0,389.0,25Q425
HIGH SCHOOL FOR HLTH CARER/SER ,28.0,385.0,417.0,373.0,06M468
LAFAYETTE HIGH SCHOOL ,40.0,327.0,367.0,315.0,21K400
Clara Barton High School ,282.0,419.0,413.0,411.0,17K600
BRONX COMMUNITY HIGH SCHOOL (X377) ,10.0,416.0,393.0,414.0,08X377
High School of Telecommunication Arts ,221.0,450.0,471.0,440.0,20K485
UNITY HIGH SCHOOL ,31.0,371.0,369.0,368.0,02M500
Humanities and Arts Magnet High School ,45.0,383.0,371.0,370.0,29Q498
NORMAN THOMAS HIGH SCHOOL ,152.0,378.0,387.0,370.0,02M620
George Wood Wingate High School ,,,,,17K470
CENTRAL PARK SECONDARY SCHOOL ,35.0,362.0,378.0,356.0,04M555
George Westinghouse Vocational Technical HS ,87.0,390.0,360.0,373.0,13K605
JOHN F KENNEDY HIGH SCHOOL ,87.0,364.0,375.0,358.0,10X475
HIGH SCHOOL MEDICAL SCIENCES ,98.0,423.0,450.0,435.0,09X413
High School of Hospitality Management ,43.0,397.0,415.0,391.0,02M296
MANHATTAN VILLAGE ACADEMY ,90.0,465.0,479.0,472.0,02M439
NEW YORK CITY MUSEUM SCHOOL ,90.0,454.0,448.0,435.0,02M414
Kingsbridge International High School ,40.0,313.0,316.0,296.0,10X268
BRONX ACADEMY HIGH SCHOOL ,19.0,373.0,354.0,364.0,08X560
NEWTOWN HIGH SCHOOL ,251.0,379.0,427.0,372.0,24Q455
High School for Medical Professions ,,,,,18K633
YABC at Monroe Academy ,11.0,386.0,345.0,388.0,12X428
CHOIR ACADEMY OF HARLEM ,16.0,420.0,369.0,401.0,05M469
NEW DESIGN HIGH SCHOOL ,74.0,390.0,385.0,387.0,02M543
Bedford Stuyvesant Street Academy High School ,20.0,366.0,380.0,362.0,13K575
JAMES MADISON HIGH SCHOOL ,641.0,449.0,478.0,445.0,22K425
BROOKLYN STUDIO SECONDARY SCH ,86.0,426.0,419.0,418.0,21K690
HIGH SCHOOL TEACHING PROFESSNS ,50.0,386.0,385.0,381.0,10X433
YABC at Washington Irving High School ,,,,,02M473
Brooklyn Democracy Academy ,18.0,347.0,371.0,323.0,23K643
YABC AT HARRY S. TRUMAN HIGH SCHOOL ,,,,,11X456
Campus School of the Humanities at Erasmus Hall ,,,,,17K469
Williamsburg High School for Architecture & Design ,44.0,399.0,393.0,367.0,14K558
FLUSHING HIGH SCHOOL ,278.0,372.0,398.0,366.0,25Q460
CMSP HIGH SCHOOL ,,,,,01M509
LYONS COMMUNITY SCHOOL ,,,,,14K586
Young Women's Leadership High School ,,,,,28Q896
MS 293 City College Academy of the Arts ,,,,,06M293
Fannie Lou Hamer Freedom High School ,75.0,333.0,326.0,330.0,12X682
"Queens High School for Information, Research, and Te ",,,,,27Q302
NEW DAY ACADEMY ,24.0,368.0,349.0,358.0,12X245
BRONX SCHOOL OF LAW & FINANCE ,54.0,404.0,397.0,383.0,10X284
Bread & Rose Intergrated Arts High School ,54.0,364.0,378.0,359.0,05M685
INTERNATIONAL ARTS BUSINESS HS ,49.0,392.0,390.0,381.0,17K544
EXPLORATIONS ACADEMY ,34.0,364.0,364.0,344.0,12X251
HARVEY MILK SCHOOL ,11.0,429.0,382.0,416.0,02M586
Jacqueline Kennedy Onassis High School ,88.0,420.0,424.0,398.0,02M529
HIGH SCHOOL HLTH PROF HUMAN ,250.0,446.0,458.0,440.0,02M420
SCHOOL INTERNATIONAL STUDIES ,45.0,402.0,414.0,382.0,15K497
East New York High School of Transit Technology ,184.0,413.0,419.0,403.0,19K615
BRONX ACAD OF HEALTH CAREERS ,46.0,369.0,363.0,380.0,11X290
QUEENS HS FOR SCIENCE YORK COL ,99.0,613.0,650.0,612.0,28Q687
SCHOOL OF THE FUTURE ,79.0,475.0,488.0,466.0,02M413
ASPIRATIONS DIPLOMA PLUS HIGH SCHOOL ,35.0,349.0,329.0,341.0,23K646
Dr Susan S McKinney Secondary School of the Arts ,46.0,387.0,369.0,369.0,13K265
El Puente Academy for Peace and Justice ,16.0,375.0,386.0,394.0,14K685
SCHOOL FOR DEMOCRACY AND LEADERSHIP ,25.0,358.0,378.0,372.0,17K533
Frederick Douglass Academy III Secondary School ,44.0,399.0,414.0,406.0,09X517
FREDERICK DOUGLASS ACADEMY VI ,65.0,393.0,390.0,387.0,27Q260
YABC AT ADLAI STEVENSON HIGH SCHOOL ,,,,,08X507
HIGH SCHOOL FASHION INDUSTRIES ,301.0,419.0,420.0,413.0,02M600
YABC AT HERBERT H. LEHMAN HIGH SCHOOL ,8.0,358.0,343.0,385.0,08X408
Renaissance High School Music Theater T ,47.0,389.0,375.0,375.0,08X293
TOTTENVILLE HIGH SCHOOL ,698.0,459.0,482.0,467.0,31R455
BARD HIGH SCHOOL EARLY COLLEGE ,138.0,630.0,608.0,630.0,01M696
Multicultural High School ,,,,,19K583
LONG ISLAND CITY HIGH SCHOOL ,296.0,418.0,434.0,408.0,30Q450
Chelsea Career and Technical Education High School ,61.0,393.0,412.0,376.0,02M615
SAMUEL J TILDEN HIGH SCHOOL ,42.0,328.0,341.0,338.0,18K415
Urban Assembly School of Design and Construction ,49.0,405.0,446.0,415.0,02M300
Bronx International High School ,37.0,335.0,335.0,340.0,09X403
WASHINGTON IRVING HIGH SCHOOL ,163.0,381.0,385.0,368.0,02M460
BUSINESS COMPUTER APPLICATION ,52.0,388.0,389.0,380.0,29Q496
ROBERT F WAGNER JR SECONDARY ,49.0,420.0,440.0,421.0,24Q560
Bronx High School Performance & Stage ,41.0,383.0,360.0,387.0,12X262
ACADEMY OF HOSPITALITY AND TOURISM ,31.0,400.0,405.0,399.0,17K408
FAR ROCKAWAY HIGH SCHOOL ,31.0,350.0,369.0,360.0,27Q465
ACADEMY OF MEDICAL TECHNOLOGY ,,,,,27Q309
YABC at Franklin D. Roosevelt High School ,33.0,363.0,443.0,369.0,20K658
Urban Assembly School of Law and Justice ,104.0,414.0,415.0,412.0,13K483
NEW WORLD HIGH SCHOOL ,43.0,331.0,384.0,341.0,11X513
BRONX AEROSPACE HIGH SCHOOL ,47.0,393.0,395.0,389.0,11X545
BROOKLYN HS MUSIC AND THEATER ,37.0,385.0,351.0,381.0,17K548
MATH SCIENCE RESEARCH TECH MAG ,59.0,405.0,430.0,405.0,29Q492
School for Legal Studies ,82.0,385.0,390.0,384.0,14K477
Bushwick Leaders High School for Academic Excel ,30.0,357.0,345.0,351.0,32K556
LAW GOVERNMENT SERVICE MAGNET ,60.0,406.0,412.0,391.0,29Q494
SOUTH SHORE HIGH SCHOOL ,29.0,365.0,352.0,336.0,18K515
Liberation Diploma Plus High School ,13.0,402.0,351.0,380.0,21K728
PACIFIC HIGH SCHOOL ,9.0,356.0,352.0,343.0,15K520
ASTOR COLLEGIATE ACADEMY ,38.0,404.0,400.0,388.0,11X299
BRONX SCH LAW GOVMT & JUSTICE ,87.0,413.0,390.0,420.0,09X505
HS of Economics And Finance ,147.0,451.0,503.0,453.0,02M489
Bronx Latin School ,,,,,12X267
DISCOVERY HIGH SCHOOL ,31.0,340.0,340.0,351.0,10X549
VICTORY COLLEGIATE HIGH SCHOOL ,,,,,18K576
HARRY VAN ARSDALE HIGH SCHOOL ,,,,,14K640
HS for Media and Communications-George Washingto ,75.0,366.0,376.0,353.0,06M463
Dual Language and Asian Studies High School ,47.0,416.0,612.0,419.0,02M545
University Neighborhood High School ,60.0,394.0,419.0,387.0,01M448
FOREST HILLS HIGH SCHOOL ,627.0,468.0,491.0,462.0,28Q440
Bushwick High School ,,,,,32K480
Park West High School ,,,,,02M535
MANHATTAN/HUNTER COLL HS SCI ,80.0,481.0,525.0,469.0,03M541
HARRY S TRUMAN HIGH SCHOOL ,201.0,380.0,384.0,379.0,11X455
LEGACY SCH INTEGRATED STUDIES ,31.0,379.0,356.0,354.0,02M429
Brooklyn Secondary Sch for Collaborative Studies ,63.0,385.0,380.0,375.0,15K448
Pan American International High School ,,,,,24Q296
HARLEM RENAISSANCE HIGH SCHOOL ,19.0,402.0,394.0,367.0,05M285
Rachel Carson High School for Coastal Studies ,66.0,422.0,459.0,418.0,21K344
John Jay High School ,9.0,390.0,381.0,398.0,76K460
INDEPENDENCE HIGH SCHOOL ,16.0,404.0,419.0,395.0,02M544
JOHN DEWEY HIGH SCHOOL ,349.0,414.0,465.0,396.0,21K540
"Secondary School for Law, Journalism and Research ",50.0,406.0,409.0,393.0,15K462
BEDFORD ACADEMY HIGH SCHOOL ,50.0,453.0,469.0,441.0,13K595
PACE HIGH SCHOOL ,71.0,424.0,448.0,423.0,02M298
OLYMPUS ACADEMY ,24.0,361.0,365.0,365.0,18K635
Academy of Environment Science Secondary School ,39.0,380.0,385.0,354.0,04M635
BENJAMIN CARDOZO HIGH SCHOOL ,697.0,486.0,551.0,492.0,26Q415
South Brooklyn Community High School ,17.0,387.0,371.0,368.0,15K698
BRONX ENGINEERING & TECH ACADEMY ,36.0,374.0,402.0,364.0,10X213
Academy of Innovative Technology High School ,,,,,19K618
MANHATTAN HIGH SCHOOL - P35M ,,,,,75M035
HERBERT H LEHMAN HIGH SCHOOL ,448.0,414.0,433.0,397.0,08X405
BROOKLYN GENERATION SCHOOL ,,,,,18K566
STATEN ISLAND TECHNICAL HIGH SCHOOL ,287.0,638.0,673.0,617.0,31R605
FRANKLIN K LANE HIGH SCHOOL ,140.0,353.0,379.0,341.0,19K420
Brooklyn High Sch for Leadership Community Svc ,9.0,323.0,281.0,310.0,13K616
Liberty High School Academy for Newcomers ,32.0,343.0,465.0,362.0,02M550
ACADEMY OF FINANCE AND ENTERPRISE ,65.0,407.0,432.0,417.0,24Q264
MANHATTAN BRIDGE HIGH SCHOOL ,31.0,345.0,380.0,325.0,02M542
Information Technology Academy ,56.0,418.0,411.0,398.0,10X368
BRONX THEATER HIGH SCHOOL ,50.0,406.0,389.0,388.0,10X546
PS12X LEWIS AND CLARK SCHOOL ,,,,,75X012
MARBLE HILL SCH INTL STUDIES ,70.0,406.0,429.0,403.0,10X477
WEST BRONX ACADEMY FOR FUTURE ,32.0,365.0,382.0,375.0,10X243
Satellite Academy High School ,16.0,400.0,336.0,376.0,02M570
NEW YORK CITY PUB SCH REP COMP ,32.0,415.0,405.0,397.0,02M531
EDWARD R MURROW HIGH SCHOOL ,686.0,472.0,503.0,468.0,21K525
BROOKLYN TECHNICAL HIGH SCHOOL ,1047.0,588.0,652.0,581.0,13K430
"Enterprise, Business and Technology High School ",80.0,360.0,390.0,354.0,14K478
NYC iSchool ,,,,,02M376
Cultural Academy for the Arts and Sciences ,,,,,18K629
Jonathan Levin HS for Media and Communications ,81.0,347.0,353.0,351.0,09X414
Acorn High School for Social Justice ,34.0,367.0,364.0,364.0,16K498
Grace Dodge Vocational High School ,93.0,380.0,385.0,369.0,10X660
Robert F Kennedy Community High School ,61.0,449.0,471.0,462.0,25Q670
HIGH SCHOOL FOR PUBLIC SERVICE ,83.0,412.0,427.0,420.0,17K546
High School For Law Enforcement And Public Safety ,62.0,408.0,429.0,412.0,28Q690
YABC AT ABRAHAM LINCOLN HIGH SCHOOL ,,,,,21K412/21K411
AUTOMOTIVE HIGH SCHOOL ,73.0,353.0,359.0,340.0,14K610
Kurt Hahn Expeditionary Learning School ,,,,,18K569
MOTT HALL BRONX HIGH SCHOOL ,63.0,395.0,398.0,399.0,09X252
Pablo Neruda Academy Architecture & World Studies ,54.0,359.0,358.0,338.0,08X305
VALIDUS PREPARATORY ACADEMY ,90.0,359.0,347.0,356.0,09X263
EBC High School for Public Service - East New York ,24.0,376.0,358.0,368.0,23K645
High School For Math Science Engineering City Coll ,106.0,592.0,627.0,575.0,05M692
HIGH SCHOOL FOR ARTS/BUSINESS ,127.0,363.0,372.0,363.0,24Q550
Young Women's Leadership School of Astoria ,,,,,04M610
CYPRESS HILLS COLLEGIATE PREPARATORY SCH ,50.0,398.0,402.0,378.0,19K659
METROPOLITAN HIGH SCHOOL ,42.0,340.0,361.0,335.0,12X248
NEW EXPLORERS HIGH SCHOOL ,36.0,382.0,376.0,376.0,07X547
PHOENIX SCHOOL ,7.0,404.0,423.0,416.0,79X490
GRAMERCY ARTS HIGH SCHOOL ,49.0,395.0,376.0,386.0,02M374
YABC AT JOHN F. KENNEDY HIGH SCHOOL ,12.0,389.0,383.0,364.0,10X478
"High School For Arts, Imagination And Inquiry ",57.0,364.0,378.0,357.0,03M299
High School for Law and Public Service ,106.0,388.0,388.0,378.0,06M467
WEST BROOKLYN COMMUNITY HIGH SCHOOL ,11.0,363.0,382.0,381.0,15K529
William E. Grady Vocational Technical High School ,56.0,385.0,393.0,361.0,21K620
NEW DORP HIGH SCHOOL ,282.0,431.0,446.0,434.0,31R440
MS 348 Washington Heights Expeditionary Learning S ,,,,,06M348
